{
  "schema_version": "prompt-pipeline-progress-impact.v1",
  "impact_id": "PROMPT-QUALITY-IMPACT-0002",
  "impact_version": 1,
  "impact_hash": "sha256:5bc7011e796ba4574682b1e1c9ebfb4c0990442948a7568f1fb101fb5625e312",
  "sequence_number": 2,
  "previous_impact_id": "PROMPT-QUALITY-IMPACT-0001",
  "repository": "rezahh107/Prompt-Pipeline",
  "program_id": "PROMPT-QUALITY-MIGRATION-EXECUTION-PROGRAM",
  "task_id": "PROMPT-QUALITY-PROGRAM-ACTIVATION",
  "pull_request": 29,
  "base_sha": "e3f98e007bba01ba02310b01377f617c94ca8b09",
  "scope_revision": "sha256:86b9aef93b9602de6b7e5af019da26340ef82a67c3b0ae1ed450e93d9ab0fb8a",
  "exact_head_binding": {"mode": "ci_runtime_exact_head", "head_sha": null},
  "work_type": "maintenance",
  "changed_paths": [
    "package.json",
    "planning/NEXT_WORK.md",
    "planning/prompt-quality/current-scope.json",
    "planning/prompt-quality/evidence/receipts/PROMPT-QUALITY-RECEIPT-PROGRAM-ACTIVATION-EXACT-HEAD.json",
    "planning/prompt-quality/evidence/receipts/PROMPT-QUALITY-RECEIPT-PROGRAM-ACTIVATION-EXACT-MAIN.json",
    "planning/prompt-quality/evidence/receipts/PROMPT-QUALITY-RECEIPT-PROGRAM-ACTIVATION-OWNER-MERGE.json",
    "planning/prompt-quality/evidence/sources/pr-29-owner-merge.raw.json",
    "planning/prompt-quality/impacts/0002-PROMPT-QUALITY-PROGRAM-ACTIVATION-RECONCILIATION.json",
    "planning/prompt-quality/lifecycle/PROMPT-QUALITY-PROGRAM-ACTIVATION.ledger.json",
    "planning/prompt-quality/prompt-quality-execution-program.v1.json",
    "planning/prompt-quality/schemas/prompt-pipeline-evidence-receipt.v1.schema.json",
    "planning/prompt-quality/scopes/PROMPT-QUALITY-PROGRAM-ACTIVATION-POST-MERGE-RECONCILIATION.scope.json",
    "scripts/peac-prompt-quality-governance.mjs",
    "scripts/peac-prompt-quality-reconciliation-self-test.mjs",
    "scripts/prompt-quality-governance/evidence.mjs",
    "scripts/prompt-quality-governance/lifecycle.mjs",
    "scripts/prompt-quality-governance/program.mjs"
  ],
  "state_before": {"registration_state":"registered","authorization_state":"authorized","execution_state":"eligible","implementation_state":"implemented","completion_state":"incomplete"},
  "state_after": {"registration_state":"registered","authorization_state":"authorized","execution_state":"eligible","implementation_state":"implemented","completion_state":"incomplete"},
  "baseline_before": {"authoritative_activation_state":"candidate_pending_merge","validation_state":"pending_exact_head_ci","merge_state":"pending_owner_merge","exact_main_state":"pending"},
  "baseline_after": {"authoritative_activation_state":"active","validation_state":"validated_exact_head","merge_state":"merged","exact_main_state":"verified"},
  "completed_obligation_ids": [],
  "remaining_obligation_ids": [],
  "closed_deliverable_ids": [],
  "quality_dimensions_improved": [],
  "quality_dimensions_regressed": [],
  "quality_delta": {"critical_regressions":[],"known_gaps":["reconciliation PR still requires owner Merge and fresh live-main verification before S-000 completion"]},
  "zero_delta": true,
  "blocking_defect": null,
  "maintenance_reason": "Close the post-Merge activation evidence durability gap without substantive PPQR implementation.",
  "next_task_id": "PPQR-001",
  "effects": {"quality_credit":false,"migration_promotion":"none","production_authority":"none","release_readiness":false,"production_readiness":false,"legacy_retirement":"none"},
  "quality_evidence": [],
  "migration_gate_evidence": [],
  "legacy_retirement_evidence": [],
  "production_paths": []
}
