{"schema_version":"prompt-pipeline-progress-impact.v1","impact_id":"PROMPT-QUALITY-IMPACT-0001","impact_version":1,"impact_hash":"sha256:8d5f9278d65c255ad230d1f9dec954a1706224587b38228681db150040bb9b4d","sequence_number":1,"previous_impact_id":null,"repository":"rezahh107/Prompt-Pipeline","program_id":"PROMPT-QUALITY-MIGRATION-EXECUTION-PROGRAM","task_id":"PROMPT-QUALITY-PROGRAM-ACTIVATION","pull_request":null,"base_sha":"25bd3af631c17fbfda76a3cabcaa612dfdc11143","scope_revision":"sha256:d85e0e87334b335d9f0ff87ca0eb1e26029632c27841a169959eacaf66e3e11f","exact_head_binding":{"mode":"ci_runtime_exact_head","head_sha":null},"work_type":"program_activation","changed_paths":["package.json","planning/NEXT_WORK.md","planning/PROMPT_QUALITY_EXECUTION_PLAN.md","planning/prompt-quality/current-scope.json","planning/prompt-quality/diagnostics/prompt-quality-diagnostics.v1.json","planning/prompt-quality/fixtures/adversarial.json","planning/prompt-quality/fixtures/invalid.json","planning/prompt-quality/fixtures/valid.json","planning/prompt-quality/impacts/0001-PROMPT-QUALITY-PROGRAM-ACTIVATION.json","planning/prompt-quality/lifecycle/PROMPT-QUALITY-PROGRAM-ACTIVATION.ledger.json","planning/prompt-quality/prompt-quality-execution-program.v1.json","planning/prompt-quality/schemas/prompt-pipeline-lifecycle-ledger.v1.schema.json","planning/prompt-quality/schemas/prompt-pipeline-progress-impact.v1.schema.json","planning/prompt-quality/schemas/prompt-pipeline-task-scope.v1.schema.json","planning/prompt-quality/schemas/prompt-quality-execution-program.v1.schema.json","planning/prompt-quality/scopes/PROMPT-QUALITY-PROGRAM-ACTIVATION.scope.json","scripts/peac-prompt-quality-governance.mjs"],"state_before":{"registration_state":"unregistered","authorization_state":"unauthorized","execution_state":"policy_blocked","implementation_state":"not_started","completion_state":"incomplete"},"state_after":{"registration_state":"registered","authorization_state":"authorized","execution_state":"eligible","implementation_state":"implemented","completion_state":"incomplete"},"baseline_before":{"program_authority":"absent","mutable_status_authority":"absent"},"baseline_after":{"program_authority":"planning/prompt-quality/prompt-quality-execution-program.v1.json","program_id":"PROMPT-QUALITY-MIGRATION-EXECUTION-PROGRAM","authoritative_activation_state":"candidate_pending_merge"},"completed_obligation_ids":["ACT-001","ACT-002","ACT-003","ACT-004","ACT-005","ACT-006","ACT-007","ACT-008","ACT-009"],"remaining_obligation_ids":[],"closed_deliverable_ids":["ACTIVATION-GOVERNANCE-FOUNDATION"],"quality_dimensions_improved":[],"quality_dimensions_regressed":[],"quality_delta":{"critical_regressions":[],"known_gaps":["exact-main activation remains pending owner merge"]},"zero_delta":true,"blocking_defect":null,"maintenance_reason":null,"next_task_id":"PPQR-001","effects":{"quality_credit":false,"migration_promotion":"none","production_authority":"none","release_readiness":false,"production_readiness":false,"legacy_retirement":"none"},"quality_evidence":[],"migration_gate_evidence":[],"legacy_retirement_evidence":[],"production_paths":[]}
